dataset/dataset_final_smp.csv

kode_wilayah,kode_bps,nama_kabkota,nama_pendek,jenis,sekolah_negeri,sekolah_swasta,sekolah_total,guru_negeri,guru_swasta,guru_total,murid_negeri,murid_swasta,murid_total,rasio_murid_guru,rasio_murid_guru_negeri,rasio_murid_guru_swasta,rasio_murid_sekolah,tka_rerata_bind,tka_peserta_bind,tka_rerata_mtk,tka_peserta_mtk,tka_sekolah_peserta,garis_kemiskinan_rp,penduduk_miskin_ribu,pct_penduduk_miskin,tkp_laki,tkp_perempuan,tkp_di_bawah_s1,tkp_s1_ke_atas,tkp_total,pct_tkp_s1_ke_atas,guru_per_tkp
32.01,3201,Kabupaten Bogor,Bogor,Kabupaten,109,666,775,3164,7278,10442,95170,145042,240212,23.0,30.08,19.93,309.95,62.61,72041,40.44,71879,762,531412,401.86,6.26,1654,1472,2745,381,3126,12.19,3.34
32.02,3202,Kabupaten Sukabumi,Sukabumi,Kabupaten,161,233,394,2453,2070,4523,55810,32090,87900,19.43,22.75,15.5,223.1,58.36,26044,38.39,25959,377,431785,164.63,6.41,768,684,1282,170,1452,11.71,3.12
32.03,3203,Kabupaten Cianjur,Cianjur,Kabupaten,155,299,454,2617,2514,5131,60281,39178,99459,19.38,23.03,15.58,219.07,56.11,28358,37.59,28243,433,482562,232.61,9.82,882,684,1426,140,1566,8.94,3.28
32.04,3204,Kabupaten Bandung,Bandung,Kabupaten,91,278,369,3630,3478,7108,83461,59448,142909,20.11,22.99,17.09,387.29,62.59,43238,40.23,43178,364,468974,236.06,6.04,1658,1436,2793,301,3094,9.73,2.3
32.05,3205,Kabupaten Garut,Garut,Kabupaten,141,285,426,3205,2556,5761,68851,37460,106311,18.45,21.48,14.66,249.56,57.41,32424,38.48,32371,416,407191,252.56,9.39,900,808,1541,167,1708,9.78,3.37
32.06,3206,Kabupaten Tasikmalaya,Tasikmalaya,Kabupaten,137,175,312,2200,1885,4085,41193,23060,64253,15.73,18.72,12.23,205.94,59.68,19933,38.85,19926,300,413178,185.99,10.15,612,568,1042,138,1180,11.69,3.46
32.07,3207,Kabupaten Ciamis,Ciamis,Kabupaten,80,58,138,1817,607,2424,32242,6758,39000,16.09,17.74,11.13,282.61,61.5,12262,39.11,12263,136,483644,88.72,7.19,454,366,727,93,820,11.34,2.96
32.08,3208,Kabupaten Kuningan,Kuningan,Kabupaten,79,42,121,2111,485,2596,37153,5320,42473,16.36,17.6,10.97,351.02,63.19,13202,41.59,13201,117,435184,119.67,10.74,574,526,935,165,1100,15.0,2.36
32.09,3209,Kabupaten Cirebon,Cirebon,Kabupaten,80,143,223,3035,1710,4745,60534,23181,83715,17.64,19.95,13.56,375.4,59.55,26234,39.1,26234,209,491604,229.64,10.23,742,586,1232,96,1328,7.23,3.57
32.10,3210,Kabupaten Majalengka,Majalengka,Kabupaten,80,47,127,1944,463,2407,34657,7410,42067,17.48,17.83,16.0,331.24,60.63,13102,39.29,13096,124,566574,128.67,10.31,544,372,806,110,916,12.01,2.63
32.11,3211,Kabupaten Sumedang,Sumedang,Kabupaten,73,61,134,1979,634,2613,35937,7923,43860,16.79,18.16,12.5,327.31,64.37,14436,40.37,14435,130,436490,105.82,8.81,474,364,747,91,838,10.86,3.12
32.12,3212,Kabupaten Indramayu,Indramayu,Kabupaten,91,127,218,2141,1269,3410,47492,17372,64864,19.02,22.18,13.69,297.54,58.19,19336,38.32,19325,213,578169,196.78,11.02,984,540,1363,161,1524,10.56,2.24
32.13,3213,Kabupaten Subang,Subang,Kabupaten,76,102,178,2514,997,3511,50072,13342,63414,18.06,19.92,13.38,356.26,60.2,19895,39.0,19882,173,449186,148.99,9.23,668,466,1014,120,1134,10.58,3.1
32.14,3214,Kabupaten Purwakarta,Purwakarta,Kabupaten,79,45,124,1609,449,2058,35725,5944,41669,20.25,22.2,13.24,336.04,61.33,12883,39.41,12887,121,483968,76.51,7.87,412,436,728,120,848,14.15,2.43
32.15,3215,Kabupaten Karawang,Karawang,Kabupaten,90,126,216,2604,1338,3942,73813,21709,95522,24.23,28.35,16.22,442.23,60.44,28315,39.42,28293,215,617901,169.8,7.08,708,522,1120,110,1230,8.94,3.2
32.16,3216,Kabupaten Bekasi,Bekasi,Kabupaten,112,319,431,3514,3264,6778,91500,46617,138117,20.38,26.04,14.28,320.46,62.29,40117,40.38,40108,409,698154,191.0,4.36,1370,1024,2024,370,2394,15.46,2.83
32.17,3217,Kabupaten Bandung Barat,Bandung Barat,Kabupaten,68,141,209,1909,1526,3435,43603,23003,66606,19.39,22.84,15.07,318.69,63.31,20562,40.14,20559,199,471101,169.66,9.87,604,476,949,131,1080,12.13,3.18
32.18,3218,Kabupaten Pangandaran,Pangandaran,Kabupaten,37,19,56,783,169,952,11560,1808,13368,14.04,14.76,10.7,238.71,61.62,4231,39.63,4232,55,486285,33.09,8.03,178,124,275,27,302,8.94,3.15
32.71,3271,Kota Bogor,Kota Bogor,Kota,23,106,129,830,1438,2268,19848,24602,44450,19.6,23.91,17.11,344.57,69.61,13901,43.73,13901,125,730079,67.16,5.89,418,426,737,107,844,12.68,2.69
32.72,3272,Kota Sukabumi,Kota Sukabumi,Kota,16,31,47,547,310,857,13456,3149,16605,19.38,24.6,10.16,353.3,66.99,5250,41.96,5250,46,706415,23.17,6.9,228,156,318,66,384,17.19,2.23
32.73,3273,Kota Bandung,Kota Bandung,Kota,76,194,270,2814,2442,5256,59704,39505,99209,18.88,21.22,16.18,367.44,71.26,32664,44.33,32662,267,644417,99.12,3.78,1004,854,1507,351,1858,18.89,2.83
32.74,3274,Kota Cirebon,Kota Cirebon,Kota,19,37,56,794,365,1159,14806,3698,18504,15.97,18.65,10.13,330.43,67.33,5902,43.31,5902,52,571809,28.12,8.66,290,186,413,63,476,13.24,2.43
32.75,3275,Kota Bekasi,Kota Bekasi,Kota,56,246,302,1868,3268,5136,54883,42798,97681,19.02,29.38,13.1,323.45,70.3,31626,44.71,31631,300,864601,129.54,3.96,1116,1046,1813,349,2162,16.14,2.38
32.76,3276,Kota Depok,Kota Depok,Kota,34,235,269,1458,2828,4286,37076,39746,76822,17.92,25.43,14.05,285.58,69.39,24367,43.35,24362,261,884633,63.45,2.31,630,772,1196,206,1402,14.69,3.06
32.77,3277,Kota Cimahi,Kota Cimahi,Kota,18,32,50,778,302,1080,16315,5873,22188,20.54,20.97,19.45,443.76,71.57,7363,44.32,7361,48,642016,25.97,4.2,168,156,261,63,324,19.44,3.33
32.78,3278,Kota Tasikmalaya,Kota Tasikmalaya,Kota,22,69,91,900,876,1776,19332,9877,29209,16.45,21.48,11.28,320.98,63.76,9405,40.75,9398,87,591600,75.22,10.84,270,234,420,84,504,16.67,3.52
32.79,3279,Kota Banjar,Kota Banjar,Kota,10,18,28,328,212,540,5790,1858,7648,14.16,17.65,8.76,273.14,62.71,2504,39.75,2499,28,451277,10.97,5.73,70,38,97,11,108,10.19,5.0

README.md

#### 1. Klaster 1: Wilayah Maju (7 Daerah)

* **Anggota**: *Kota Bandung, Kota Cimahi, Kota Bekasi, Kota Bogor, Kota Depok, Kota Sukabumi, Kota Cirebon*.
* **Karakteristik**:
  * Didominasi oleh pusat-pusat kota metropolitan.
  * Capaian prestasi TKA Matematika dan Bahasa Indonesia tertinggi di Jawa Barat.
  * Daya dukung ekonomi sangat kuat dengan persentase penduduk miskin paling rendah di Jawa Barat (Depok hanya 2.31%, Bandung 3.78%, Bekasi 3.96%).
  * Rasio murid-guru dan infrastruktur sekolah berada pada standar pelayanan minimal yang sangat mapan.

#### 3. Klaster 3: Wilayah Rentan dan Terpencil (15 Daerah)

* **Anggota**: *Kabupaten Sukabumi, Cianjur, Garut, Tasikmalaya, Ciamis, Kuningan, Cirebon, Majalengka, Sumedang, Indramayu, Subang, Bandung Barat, Pangandaran, Kota Tasikmalaya, Kota Banjar*.
* **Karakteristik**:
  * **Tantangan Kemiskinan**: Memiliki tingkat kemiskinan tertinggi di Jawa Barat (rata-rata **9.18%**, di mana Indramayu mencapai **11.02%**, Kuningan **10.74%**, dan Tasikmalaya **10.15%**).
  * **Tantangan Dispersi Geografis / Sekolah Terpencil**: Rasio murid per sekolah kecil (rata-rata hanya 291 murid, bahkan di Tasikmalaya 205, Cianjur 219, Sukabumi 223, Pangandaran 238). Ini menandakan banyaknya sekolah-sekolah kecil yang tersebar di wilayah geografis pegunungan dan pesisir (wilayah Jabar Selatan dan pedalaman) dengan tantangan aksesibilitas.
  * **Kesenjangan Capaian**: Rerata nilai TKA terendah di Jawa Barat.